{"schema":"https://debz.dev/schema/root-operation-record-v1","version":1,"attempt_id":"5c5c5c5c5c5c5c5c5c5c5c5c5c5c5c5c5c5c5c5c5c5c5c5c5c5c5c5c5c5c5c5c","generation":4,"install_root":"/target","root_identity_sha256":"c0797cfb781b2ef9906fa086e9508363f4884c515c2423f377248d46865228a5","backend":"native","surface":"package_transaction","operation":"install","state":"mutating","phase":"database","step":7,"mutation_started":true,"outcome":"pending","provenance":"pending","provenance_sha256":null,"authorization_sha256":"5555555555555555555555555555555555555555555555555555555555555555","program_sha256":"6666666666666666666666666666666666666666666666666666666666666666","plan_sha256":"3333333333333333333333333333333333333333333333333333333333333333","exact_lock":{"schema":"https://debz.dev/schema/exact-closure-lock-v2","version":2,"digest_sha256":"7777777777777777777777777777777777777777777777777777777777777777"},"database_generation_sha256":"8888888888888888888888888888888888888888888888888888888888888888","artifact_evidence_sha256":"9999999999999999999999999999999999999999999999999999999999999999","request_sha256":"1111111111111111111111111111111111111111111111111111111111111111","policy_sha256":"2222222222222222222222222222222222222222222222222222222222222222","target_architecture":"amd64","foreign_architectures":["i386"],"reserved_unix":1700000000,"updated_unix":1700000042,"digest_sha256":"c21c35f3fabf436150c40609403185e61a5fde27e7986411cbd50b1d7df024f7"}